{
  "schema_version": "flashgate-benchmark/v1",
  "benchmark_suite_version": "flashgate-benchmark-suite/v1",
  "workflow_catalog_version": "flashgate-benchmark-workflows/v1",
  "corpus_version": "flashgate-benchmark-corpus/v1",
  "project": "flashgate-mcp",
  "commit": "cfd211fa81cc48ee1dc463966718442f2ab5223c",
  "working_tree_dirty": false,
  "generated_at_utc": "2026-07-18T13:56:50.432617558Z",
  "go_version": "go1.26.4",
  "os": "linux",
  "architecture": "amd64",
  "runtime_mode": "direct_stdio",
  "transport": "stdio",
  "execution_backend": "current_process",
  "profile": "read_only",
  "parallelism": 1,
  "repetitions": 30,
  "start_measurements": {
    "first_process_start": {
      "repetitions": 1,
      "duration_ns": {
        "samples": 1,
        "min": 5084584,
        "p50": 5084584,
        "p95": 5084584,
        "max": 5084584
      },
      "request_bytes": {
        "samples": 1,
        "min": 221,
        "p50": 221,
        "p95": 221,
        "max": 221
      },
      "response_bytes": {
        "samples": 1,
        "min": 151,
        "p50": 151,
        "p95": 151,
        "max": 151
      },
      "result_bytes": {
        "samples": 1,
        "min": 116,
        "p50": 116,
        "p95": 116,
        "max": 116
      },
      "resources": {
        "status": "supported",
        "idle_working_set_bytes": {
          "samples": 1,
          "min": 3670016,
          "p50": 3670016,
          "p95": 3670016,
          "max": 3670016
        },
        "peak_working_set_bytes": {
          "samples": 1,
          "min": 3670016,
          "p50": 3670016,
          "p95": 3670016,
          "max": 3670016
        },
        "user_cpu_ns": {
          "samples": 1,
          "min": 0,
          "p50": 0,
          "p95": 0,
          "max": 0
        },
        "system_cpu_ns": {
          "samples": 1,
          "min": 0,
          "p50": 0,
          "p95": 0,
          "max": 0
        }
      },
      "exit_statuses": {
        "0": 1
      },
      "stderr_warnings": [],
      "stderr_warning_count": 0
    },
    "subsequent_process_start": {
      "repetitions": 30,
      "duration_ns": {
        "samples": 30,
        "min": 3221296,
        "p50": 4438385,
        "p95": 5728971,
        "max": 6426307
      },
      "request_bytes": {
        "samples": 30,
        "min": 221,
        "p50": 221,
        "p95": 221,
        "max": 221
      },
      "response_bytes": {
        "samples": 30,
        "min": 151,
        "p50": 151,
        "p95": 151,
        "max": 151
      },
      "result_bytes": {
        "samples": 30,
        "min": 116,
        "p50": 116,
        "p95": 116,
        "max": 116
      },
      "resources": {
        "status": "supported",
        "idle_working_set_bytes": {
          "samples": 30,
          "min": 3563520,
          "p50": 3637248,
          "p95": 3829760,
          "max": 3866624
        },
        "peak_working_set_bytes": {
          "samples": 30,
          "min": 3563520,
          "p50": 3637248,
          "p95": 3829760,
          "max": 3866624
        },
        "user_cpu_ns": {
          "samples": 30,
          "min": 0,
          "p50": 0,
          "p95": 0,
          "max": 0
        },
        "system_cpu_ns": {
          "samples": 30,
          "min": 0,
          "p50": 0,
          "p95": 0,
          "max": 0
        }
      },
      "exit_statuses": {
        "0": 30
      },
      "stderr_warnings": [],
      "stderr_warning_count": 0
    }
  },
  "resource_measurements": {
    "status": "supported",
    "idle_working_set_bytes": {
      "samples": 333,
      "min": 3555328,
      "p50": 3653632,
      "p95": 3805184,
      "max": 3895296
    },
    "peak_working_set_bytes": {
      "samples": 333,
      "min": 3563520,
      "p50": 3735552,
      "p95": 5124096,
      "max": 5341184
    },
    "user_cpu_ns": {
      "samples": 333,
      "min": 0,
      "p50": 0,
      "p95": 0,
      "max": 10000000
    },
    "system_cpu_ns": {
      "samples": 333,
      "min": 0,
      "p50": 0,
      "p95": 10000000,
      "max": 10000000
    }
  },
  "tools_list_measurements": [
    {
      "profile": "read_only",
      "tool_count": 3,
      "schema_count": 3,
      "request_bytes": 59,
      "response_bytes": 2134,
      "result_bytes": 2099,
      "approx_tokens_bytes4": 534
    },
    {
      "profile": "default",
      "tool_count": 8,
      "schema_count": 8,
      "request_bytes": 59,
      "response_bytes": 5904,
      "result_bytes": 5869,
      "approx_tokens_bytes4": 1476
    }
  ],
  "workflow_measurements": [
    {
      "name": "initialize",
      "repetitions": 30,
      "calls": 0,
      "request_bytes": {
        "samples": 30,
        "min": 221,
        "p50": 221,
        "p95": 221,
        "max": 221
      },
      "response_bytes": {
        "samples": 30,
        "min": 151,
        "p50": 151,
        "p95": 151,
        "max": 151
      },
      "result_bytes": {
        "samples": 30,
        "min": 116,
        "p50": 116,
        "p95": 116,
        "max": 116
      },
      "duration_ns": {
        "samples": 30,
        "min": 3449049,
        "p50": 4143265,
        "p95": 5234212,
        "max": 5325786
      },
      "read_bytes": {
        "samples": 30,
        "min": 0,
        "p50": 0,
        "p95": 0,
        "max": 0
      },
      "written_bytes": {
        "samples": 30,
        "min": 0,
        "p50": 0,
        "p95": 0,
        "max": 0
      },
      "scanned_bytes": {
        "samples": 30,
        "min": 0,
        "p50": 0,
        "p95": 0,
        "max": 0
      },
      "entries": {
        "samples": 30,
        "min": 0,
        "p50": 0,
        "p95": 0,
        "max": 0
      },
      "approx_tokens_bytes4": {
        "samples": 30,
        "min": 38,
        "p50": 38,
        "p95": 38,
        "max": 38
      },
      "resources": {
        "status": "supported",
        "idle_working_set_bytes": {
          "samples": 30,
          "min": 3563520,
          "p50": 3649536,
          "p95": 3809280,
          "max": 3821568
        },
        "peak_working_set_bytes": {
          "samples": 30,
          "min": 3563520,
          "p50": 3649536,
          "p95": 3809280,
          "max": 3821568
        },
        "user_cpu_ns": {
          "samples": 30,
          "min": 0,
          "p50": 0,
          "p95": 0,
          "max": 0
        },
        "system_cpu_ns": {
          "samples": 30,
          "min": 0,
          "p50": 0,
          "p95": 0,
          "max": 0
        }
      },
      "exit_statuses": {
        "0": 30
      },
      "stderr_warnings": [],
      "stderr_warning_count": 0
    },
    {
      "name": "initialize_tools_list",
      "repetitions": 30,
      "calls": 0,
      "request_bytes": {
        "samples": 30,
        "min": 280,
        "p50": 280,
        "p95": 280,
        "max": 280
      },
      "response_bytes": {
        "samples": 30,
        "min": 2285,
        "p50": 2285,
        "p95": 2285,
        "max": 2285
      },
      "result_bytes": {
        "samples": 30,
        "min": 2215,
        "p50": 2215,
        "p95": 2215,
        "max": 2215
      },
      "duration_ns": {
        "samples": 30,
        "min": 4213866,
        "p50": 5144078,
        "p95": 6097068,
        "max": 6537095
      },
      "read_bytes": {
        "samples": 30,
        "min": 0,
        "p50": 0,
        "p95": 0,
        "max": 0
      },
      "written_bytes": {
        "samples": 30,
        "min": 0,
        "p50": 0,
        "p95": 0,
        "max": 0
      },
      "scanned_bytes": {
        "samples": 30,
        "min": 0,
        "p50": 0,
        "p95": 0,
        "max": 0
      },
      "entries": {
        "samples": 30,
        "min": 0,
        "p50": 0,
        "p95": 0,
        "max": 0
      },
      "approx_tokens_bytes4": {
        "samples": 30,
        "min": 572,
        "p50": 572,
        "p95": 572,
        "max": 572
      },
      "resources": {
        "status": "supported",
        "idle_working_set_bytes": {
          "samples": 30,
          "min": 3567616,
          "p50": 3624960,
          "p95": 3850240,
          "max": 3891200
        },
        "peak_working_set_bytes": {
          "samples": 30,
          "min": 3641344,
          "p50": 3698688,
          "p95": 3932160,
          "max": 3973120
        },
        "user_cpu_ns": {
          "samples": 30,
          "min": 0,
          "p50": 0,
          "p95": 0,
          "max": 0
        },
        "system_cpu_ns": {
          "samples": 30,
          "min": 0,
          "p50": 0,
          "p95": 0,
          "max": 0
        }
      },
      "exit_statuses": {
        "0": 30
      },
      "stderr_warnings": [],
      "stderr_warning_count": 0
    },
    {
      "name": "get_path_info_existing",
      "repetitions": 30,
      "calls": 1,
      "request_bytes": {
        "samples": 30,
        "min": 338,
        "p50": 338,
        "p95": 338,
        "max": 338
      },
      "response_bytes": {
        "samples": 30,
        "min": 426,
        "p50": 426,
        "p95": 426,
        "max": 426
      },
      "result_bytes": {
        "samples": 30,
        "min": 356,
        "p50": 356,
        "p95": 356,
        "max": 356
      },
      "duration_ns": {
        "samples": 30,
        "min": 3569793,
        "p50": 4666158,
        "p95": 5688414,
        "max": 5956500
      },
      "read_bytes": {
        "samples": 30,
        "min": 0,
        "p50": 0,
        "p95": 0,
        "max": 0
      },
      "written_bytes": {
        "samples": 30,
        "min": 0,
        "p50": 0,
        "p95": 0,
        "max": 0
      },
      "scanned_bytes": {
        "samples": 30,
        "min": 0,
        "p50": 0,
        "p95": 0,
        "max": 0
      },
      "entries": {
        "samples": 30,
        "min": 0,
        "p50": 0,
        "p95": 0,
        "max": 0
      },
      "approx_tokens_bytes4": {
        "samples": 30,